id,position,country,jurisdiction,deputy,list,start,end,before,after,enwiki
Q15710848,President of the Central African Republic,Q929,Q929,,Q1969668,,,,,
Q48998251,Vice President of the Central African Republic,Q929,Q929,,,,,,,Vice President of the Central African Republic
Q16773091,Prime Minister of the Central African Republic,Q929,Q929,,Q2062793,,,,,
Q18204366,Minister of Foreign Affairs,Q929,Q929,,,,,,,Minister of Foreign Affairs (Central African Republic)
Q108822572,President of the National Assembly of the Central African Republic,Q929,Q929,,Q6594822,,,,,
