@@,name,position
---,Théodore Bikoo,Minister of Interior
---,Maurice Regonessa,Minister of Interior
---,Martin Ziguélé,Prime Minister of the Central African Republic
---,Jean-Baptiste Nouganga,"Minister of Environment, Water, Forests, Hunting and Fisheries"
---,Daniel Emery Dede,Minister of Agriculture and Livestock
+++,"Maurice Regonessa, remplacé le 15 décembre 2000 par Théodore Bikoo",Ministre de l’Intérieur
+++,Jacob Mbaïtadjim,Ministre délégué à l'Économie
+++,Daniel Emery Dédé,"Ministre del’Environnement, des Eaux, Forêts, Chasse, Pêche"
